Barkod,Ürün Adı,Maliyet (TL),Kargo (TL),Komisyon (%)
AYT003IMT00540,"Zarif Şık Inci Kolye Bileklik Küpe Set (NİKAH, DÜĞÜN, KINA, NİŞAN VE ÖZEL DAVETLER IÇİN INCİ SET)",60.0,100.0,22.5
AYT003IMT00744,"İnci Set, Paslanmaz Çelik Uzatma Zincirli Kolye Bileklik Küpe",60.0,100.0,22.5
AYT001INCI0024,"Gerçek Barok İncili Dorika Detaylı Paslanmaz Çelik Uzun Kolye, Gümüş Renk",663.3333333333334,100.0,22.5
AYT012AND0001,Ham Andız 17'li Efe Tesbih - 13mm Tornalanmamış Doğal Dokulu Bilek Boyu,96.66666666666669,100.0,22.5
AYT012AND0002,Tornalanmış Andız 17'li Efe Tesbih - 13mm İşlemeli Doğal Çekirdek (15 cm),130.0,100.0,22.5
AYT012KUKA0001,3x9 mm İnce Arpa Kesim Kuka Tesbih - Sistemli ve Zarif Tasarım (15 cm),130.0,100.0,22.5
AYT001INCI0023,"Gerçek Barok İncili Dorika Detaylı Paslanmaz Çelik Uzun Kolye, Altın renk",663.3333333333334,100.0,22.5
AYT012DGL0001,"Bileğinde Şıklık, Elinde Huzur: 2'si 1 Arada Volkan Taşı Tesbih Bileklik Tasarım",149.66666666666666,100.0,22.5
AYT003IMT002240,"Asil, Modern, Tarz Siyah İnci Boncuk Set Paslanmaz Çelik Zincir Kolye Bileklik Küpe",159.6,100.0,22.5
AYT003IMT002140,"Siyah&Beyaz İnci Set, A Kalite Boncuk İnci Paslanmaz Çelik Kolye, Bileklik ve Küpe Takımı",166.33333333333334,100.0,22.5
AYT001INCI001960,Gerçek Kültür İncisi Dorika Detaylı Gümüş Renk Çelik Kolye 60cm Kararmaz,353.1266666666667,100.0,22.5
AYT001INCI002060,Gerçek Kültür İncisi Dorika Detaylı Gold Renk Çelik Kolye 60cm Kararmaz,353.1266666666667,100.0,22.5
AYT001INCI002240,Gerçek Kültür İncisi Dorika Detaylı Gold Renk Çelik Kolye 40cm Kararmaz,328.6166666666667,100.0,22.5
AYT001INCI001860,Gerçek Kültür İncisi Gold Renk Paslanmaz Çelik Zincir Kolye 60 cm Kararmaz,304.1066666666667,100.0,22.5
AYT001INCI002140,Gerçek Kültür İncisi Dorika Detaylı Gümüş Renk Çelik Kolye 40cm Kararmaz,328.6166666666667,100.0,22.5
AYT013KDF18X21001,Lüks Kadife Kaplama Kurdeleli Takı Seti Kutusu (18x21 cm) Siyah,233.0,100.0,22.5
AYT001INCI001760,Gerçek Kültür İncisi Gümüş Renk Paslanmaz Çelik Zincir Kolye (60 cm),304.1066666666667,100.0,22.5
AYT001DGL000140,Faset Kesim Turmalin Doğaltaş Kolye - Paslanmaz Çelik Aparatlı Şık Tasarım,380.0,100.0,22.5
AYT003INCI002945,Modern Barok İnci Takı Seti - El Yapımı Çubuk İnci Kolye ve Küpe Kombini (Düzensiz Model),3000.0,100.0,22.5
AYT003INCI002840,Zarafetin En Saf Hali: El Yapımı Gerçek Barok İnci Takı Seti,3800.0,100.0,22.5
AYT003INCI002745,Barok Kültür İncisi Antrasit Takı Seti - Paslanmaz Çelik Detaylı,3999.6,100.0,22.5
AYT003INCI002645,"Barok İnci Antrasit Takı Seti - Kolye, Bileklik ve Küpe",3999.6,100.0,22.5
AYT001INCI001645,Gerçek Barok İnci Tasarım Kolye - Antrasit İri Taneli El İşçiliği,1996.0,100.0,22.5
AYT012ZAZA0022,Usta İşi Zamak Zaza Tesbih,519.6,100.0,22.5
AYT012ZAZA0018,Usta İşi Zamak Üzerine İşlemeli Zaza Tesbih,519.6,100.0,22.5
AYT012ZAZA0020,Zamak Zaza Tesbih - Özel Tasarım,519.6,100.0,22.5
AYT012ZAZA0019,Usta İşi Zamak işlemeli Zaza Tesbih - Özel Tasarım,519.6,100.0,22.5
AYT012ZAZA0021,Usta İşi İşlemeli Zamak Zaza Tesbih - Özel Tasarım,519.6,100.0,22.5
AYT002DGL0005,Orijinal Selenit Doğal Taş Bileklik - Özel Tasarım Pirinç İşlemeli Zamak Detaylı,432.0,100.0,22.5
AYT002DGL000218,Orijinal Kristal Kuvars (Necef Taşı) Doğal Taş Bileklik,356.0,100.0,22.5
AYT002DGL001618,Orijinal Bronzit Doğal Taş Bileklik,302.0,100.0,22.5
AYT002DGL000718,Orijinal Pembe Kuvars Bileklik - El Yapımı Zamak ve Pirinç Detaylı,304.0,100.0,22.5
AYT002DGL000318,Desenli Dzi Agat (Tibet Akiği) Doğal Taş Bileklik,356.0,100.0,22.5
AYT002DGL000418,Orijinal Ay Taşı Doğal Taş Bileklik,396.0,100.0,22.5
AYT002DGL001018,Orijinal Ametist Doğal Taş Bileklik - Zirkon Taşlı Pirinç İşlemeli,302.0,100.0,22.5
AYT002DGL001318,Orijinal Rodokrozit Doğal Taş Bileklik - Zamak Üzeri Pirinç İşlemeli,835.1999999999999,100.0,22.5
AYT002DGL001418,Orijinal Ateş Kuvars (Fire Quartz) Doğal Taş Bileklik,344.0,100.0,22.5
AYT002DGL000918,Orijinal Firuze (Turkuaz) Doğal Taş Bileklik - Zamak Üzeri Pirinç İşlemeli,236.0,100.0,22.5
AYT002DGL000818,Özgüven ve Nezaket Taşı Bronzit Bileklik - Zamak Üzeri Pirinç İşlemeli,356.0,100.0,22.5
AYT002DGL001118,Orijinal Şeker Morganit Doğal Taş Bileklik - Pastel Renkli Aşk ve Huzur Taşı,386.0,100.0,22.5
AYT002DGL000618,Orijinal Tibet Akiği Doğal Taş Bileklik | El İşçiliği Zamak - Pirinç Tasarım,356.0,100.0,22.5
AYT002DGL001218,Orijinal Kanada Yeşimi (Jade) Doğal Taş Bileklik - Zamak Üzeri Pirinç İşlemeli,484.4,100.0,22.5
AYT002DGL001518,Orijinal Siyah Turmalin Doğal Taş Bileklik - Negatif Enerji ve Radyasyon Kalkanı,344.0,100.0,22.5
AYT012ZAZA0005,Usta İşi Pirinç İşlemeli ve Doğal Taşlı Zamak Zaza Tesbih - Özel Tasarım Zebercet Taşı (Peridot),519.6,100.0,22.5
AYT012ZAZA0006,Usta İşi Pirinç İşlemeli ve Doğal Taşlı Zamak Zaza Tesbih - Özel Tasarım Zebercet Taşı (Peridot),519.6,100.0,22.5
AYT012ZAZA0003,Usta İşi Pirinç İşlemeli ve Doğal Taşlı Zamak Zaza Tesbih - Özel Tasarım Zebercet Taşı (Peridot),519.6,100.0,22.5
AYT012ZAZA0008,Usta İşi Pirinç İşlemeli ve Doğal Taşlı Zamak Zaza Tesbih - Özel Tasarım Zebercet Taşı (Peridot),519.6,100.0,22.5
AYT012ZAZA0004,Usta İşi Pirinç İşlemeli ve Doğal Taşlı Zamak Zaza Tesbih - Özel Tasarım Akik Taşı,519.6,100.0,22.5
AYT012ZAZA0014,Usta İşi Pirinç İşlemeli ve Doğal Taşlı Zamak Zaza Tesbih - Özel Tasarım,519.6,100.0,22.5
AYT012ZAZA0009,Usta İşi Pirinç İşlemeli ve Doğal Taşlı Zamak Zaza Tesbih - Özel Tasarım,519.6,100.0,22.5
AYT012ZAZA0010,Usta İşi Pirinç İşlemeli ve Doğal Taşlı Zamak Zaza Tesbih - Özel Tasarım,519.6,100.0,22.5
AYT012ZAZA0012,Usta İşi Pirinç İşlemeli ve Doğal Taşlı Zamak Zaza Tesbih - Özel Tasarım,519.6,100.0,22.5
AYT012ZAZA0002,Usta İşi Pirinç İşlemeli ve Doğal Taşlı Zamak Zaza Tesbih - Özel Tasarım Akik Taşı,519.6,100.0,22.5
AYT012ZAZA0015,Usta İşi Pirinç İşlemeli ve Doğal Taşlı Zamak Zaza Tesbih - Özel Tasarım,519.6,100.0,22.5
AYT012ZAZA0017,Usta İşi Pirinç İşlemeli ve Doğal Taşlı Zamak Zaza Tesbih - Özel Tasarım,519.6,100.0,22.5
AYT012ZAZA0011,Usta İşi Pirinç İşlemeli ve Doğal Taşlı Zamak Zaza Tesbih - Özel Tasarım,519.6,100.0,22.5
AYT012ZAZA0007,Usta İşi Pirinç İşlemeli ve Doğal Taşlı Zamak Zaza Tesbih - Özel Tasarım Akik Taşı,519.6,100.0,22.5
AYT012ZAZA0016,Usta İşi Pirinç İşlemeli ve Doğal Taşlı Zamak Zaza Tesbih - Özel Tasarım,519.6,100.0,22.5
AYT012ZAZA0001,Usta İşi Pirinç İşlemeli ve Doğal Taşlı Zamak Zaza Tesbih - Özel Tasarım Kaplan Gözü Taşı,519.6,100.0,22.5
AYT002LAJA1706,El Yapımı Bakır Bileklik | Etnik Desenli UV Baskı | Unisex Tasarım,232.0,100.0,22.5
AYT002LAJA1703,El Yapımı Bakır Bileklik | Etnik Desenli UV Baskı | Unisex Tasarım,232.0,100.0,22.5
AYT002BKR1020SET,"El Yapımı Saf Bakır Bileklik ve Yüzük - Çekiç Desenli, Unisex, Şık ve Sağlıklı",260.0,100.0,22.5
AYT002LAJA1702,El Yapımı Bakır Bileklik | Etnik Desenli UV Baskı | Unisex Tasarım,232.0,100.0,22.5
AYT002LAJA1709,El Yapımı Bakır Bileklik | Etnik Desenli UV Baskı | Unisex Tasarım,232.0,100.0,22.5
AYT002LAJA1707,El Yapımı Bakır Bileklik | Etnik Desenli UV Baskı | Unisex Tasarım,232.0,100.0,22.5
AYT001IMT0004K40,klasik inci choker kolye,79.60000000000001,100.0,22.5
AYT003INCI002540,"Doğal inci set, Kolye Bileklik Küpe inci takım",1000.0,100.0,22.5
AYT001INCI001540,"Doğal inci kolye, el yapımı, hematit detaylı, paslanmaz çelik malzemeler",760.0,100.0,22.5
AYT003INCI0002440,Doğal Inci Kolye Bileklik Set Hematit Taş Detaylı,996.0,100.0,22.5
AYT002CLK000318,İnce hasır zincir detaylı su yolu çelik bileklik,159.6,100.0,22.5
AYT006BKR0009,"BAKIR YÜZÜK, El Yapımı %100 Bakır",128.10333333333332,100.0,22.5
AYT002BKR0009,"BAKIR BİLEZİK, El Yapımı %100 Bakır",190.0,100.0,22.5
AYT002BKR0008,"BAKIR BİLEZİK, El Yapımı %100 Bakır",190.0,100.0,22.5
AYT002BKR0007,"BAKIR BİLEZİK, El Yapımı %100 Bakır",190.0,100.0,22.5
AYT003INCI002145,Doğal Turkuaz Taşlı İri Barok İnci Kolye Bileklik Seti,760.0,100.0,22.5
AYT003INCI002345,Doğal Amazonit Taşlı İri Barok İnci Kolye Bileklik Seti,760.0,100.0,22.5
AYT003INCI002245,Doğal Ametist Taşlı İri Barok İnci Kolye Bileklik Seti,760.0,100.0,22.5
AYT003INCI002045,Doğanın Zarafeti: Hakiki Mercan ve Barok İnci Takı Seti,760.0,100.0,22.5
AYT003INCI001845,Modern Minimalist Altın Renk Paslanmaz Çelik İnci Detaylı Takı Seti,640.0,100.0,22.5
AYT003INCI001945,Modern Minimalist Gümüş Renk Paslanmaz Çelik İnci Detaylı Takı Seti,640.0,100.0,22.5
AYT003INCI0017G40,"Doğal Çubuk Barok İnci, Gümüş Kalpli Kolye & Bileklik Seti",2320.0,100.0,22.5
AYT003INCI0016A40,"Doğal Çubuk Barok İnci, Altın Kaplama Gümüş Kalpli Kolye & Bileklik Seti",2320.0,100.0,22.5
AYT003INCI0015G40,"Doğal Barok İnci Set, Gümüş Kalpli Kolye & Bileklik Seti",5519.599999999999,100.0,22.5
AYT003INCI001440,"Doğal Barok İnci Set, Gümüş Gemici Kilitli Kolye & Küpe Seti",3500.0,100.0,22.5
AYT001INCI0013A45,Doğal İnci ve Paslanmaz Çelik Detaylı Kolye,1200.0,100.0,22.5
AYT001INCI0013G45,Doğal İnci ve Paslanmaz Çelik Detaylı Kolye,1200.0,100.0,22.5
AYT001INCI0014A45,Doğal Siyah İnci ve Paslanmaz Çelik Detaylı Kolye,1280.0,100.0,22.5
AYT001INCI0014G45,Doğal Siyah İnci ve Paslanmaz Çelik Detaylı Kolye,1280.0,100.0,22.5
AYT001INCI0001245,"Doğal siyah inci kolye, minimalist zerafetin siyah incisi",1280.0,100.0,22.5
AYT001INCI00011,"Doğal inci kolye, minimalist zerafetin incisi",1160.0,100.0,22.5
AYT001INCI00010A45,"Doğal siyah inci kolye, paslanmaz çelik zincir ve O-T kapama kombinli",900.0,100.0,22.5
AYT001INCI00010G45,"Doğal siyah inci kolye, paslanmaz çelik zincir ve O-T kapama kombinli",900.0,100.0,22.5
AYT001INCI0009A45,"Doğal İnci Kolye, Paslanmaz Çelik Zincir ve O-T kapama kombinli",799.6,100.0,22.5
AYT001INCI0009G45,"Doğal İnci Kolye, Paslanmaz Çelik Zincir ve O-T kapama kombinli",799.6,100.0,22.5
AYT003INCI001340,"Doğal inci set, gümüş renk paslanmaz çelik istiridye detaylı, kolye bileklik ve küpe seti",1400.0,100.0,22.5
AYT003INCI001240,"Doğal inci set, altın renk paslanmaz çelik istiridye detaylı, kolye bileklik ve küpe seti",1400.0,100.0,22.5
AYT003IMT02040,"İnci set, zirkon taşlı rondela ve paslanmaz çelik klips ve zincir detaylı Kolye Bileklik Küpe Set",139.6,100.0,22.5
AYT001IMT000440,klasik inci choker kolye,79.60000000000001,100.0,22.5
AYT001IMT000340,barok inci kolye altın top detaylı,79.60000000000001,100.0,22.5
AYT001IMT000240,inci kolye zarif istiridye uç detaylı,79.60000000000001,100.0,22.5
AYT001IMT0001B40,inci kolye zarif kalp detaylı,79.60000000000001,100.0,22.5
AYT001IMT0001S40,inci kolye zarif kalp detaylı,79.60000000000001,100.0,22.5
AYT001CLK0002A,"Sonsuzluğa Sarılan Sevgili Kolyesi, Paslanmaz Çelik",130.0,100.0,22.5
AYT002CLK0002A,Zirkon Taşlı 316L Çelik Kelepçe,196.0,100.0,22.5
AYT003IMT017A40,"İnci Kolye Bileklik Küpe  Set, Paslanmaz Çelik İstiridye Uçlu, Altın Rengi",174.0,100.0,22.5
AYT003IMT016G40,"İnci Kolye Bileklik Küpe  Set, Paslanmaz Çelik İstiridye Uçlu, Gümüş Rengi",174.0,100.0,22.5
AYT003IMT015G40,"İnci Kolye Bileklik Küpe  Set, Paslanmaz Çelik Hilal Uçlu Gümüş Rengi",174.0,100.0,22.5
AYT003IMT014A40,"İnci Kolye Bileklik Küpe  Set, Paslanmaz Çelik Hilal Uçlu, Altın Rengi",174.0,100.0,22.5
AYT003IMT012G40,"İnci Kolye Bileklik Küpe  Set, Paslanmaz Çelik Lotus Çiçeği Gümüş Rengi",174.0,100.0,22.5
AYT003IMT013A40,"İnci Kolye Bileklik Küpe  Set, Paslanmaz Çelik Lotus Çiçeği Altın Rengi",174.0,100.0,22.5
AYT002BKR0004,"BAKIR BİLEZİK, El Yapımı %100 Bakır",190.0,100.0,22.5
AYT002BKR0002,"BAKIR BİLEZİK, El Yapımı %100 Bakır",190.0,100.0,22.5
AYT002BKR0005,"BAKIR BİLEZİK, El Yapımı %100 Bakır",190.0,100.0,22.5
AYT004INCI0005A,Doğal Barok İnci Küpe,340.0,100.0,22.5
AYT004INCI0004G,Doğal Barok İnci Küpe,140.0,100.0,22.5
AYT004INCI0005G,Doğal Barok İnci Küpe,340.0,100.0,22.5
AYT004INCI0003A,Doğal Barok Siyah İnci Küpe,320.0,100.0,22.5
AYT004INCI0002A,Doğal Barok İnci Küpe,360.0,100.0,22.5
AYT004INCI0002G,Doğal Barok İnci Küpe,360.0,100.0,22.5
AYT002BJTR000320,3'lü Marteniçka dilek şans bilekliği yonca yapraklı,59.99666666666667,100.0,22.5
AYT002BJTR000220,3'lü Marteniçka dilek şans bilekliği  doğal incili,99.99666666666668,100.0,22.5
AYT002BJTR000120,Marteniçka dilek şans bilekliği  nazar boncuklu,39.6,100.0,22.5
AYT002INCI0012A18,"Doğal İnci Bileklik, O T Kapama, Florit Taşlı",500.0,100.0,22.5
AYT002INCI0013G18,"Doğal İnci Bileklik, O T Kapama",316.0,100.0,22.5
AYT002INCI0009A19,"Doğal Barok İnci, Ataç Form Çelik Zincirli Bileklik",156.0,100.0,22.5
AYT002INCI0011G19,"Doğal Barok İnci, Ataç Çelik Zincirli Bileklik",156.0,100.0,22.5
AYT002INCI0011A19,"Doğal Barok İnci, Ataç Çelik Zincirli Bileklik",156.0,100.0,22.5
AYT002INCI0009G19,"Doğal Barok İnci, Ataç Form Çelik Zincirli Bileklik",156.0,100.0,22.5
AYT002INCI0010A17,"Doğal Barok İnci, Dorika Çelik Zincirli Bileklik",92.0,100.0,22.5
AYT002INCI0010G17,"Doğal Barok İnci, Dorika Çelik Zincirli Bileklik",92.0,100.0,22.5
AYT001INCI0008G40,İkili doğal barok inci kolye,596.0,100.0,22.5
AYT001INCI0008A40,İkili doğal barok inci kolye,596.0,100.0,22.5
AYT003INCI001140,"Doğal Inci Set; Kolye Bileklik Küpe, Zarafetin Ve Şıklığın Incisi",2796.0,100.0,22.5
AYT001INCI000245,"Gemici Kilitli, Paslanmaz Çelik Zincir Kombinli Doğal İnci Kolye",700.0,100.0,22.5
AYT003INCI001045,"Doğal Inci Kolye Bileklik Set, Mıknatıs Kapamalı",1996.0,100.0,22.5
AYT003INCI000940,Doğal Inci Kolye Bileklik Küpe Seti,1396.0,100.0,22.5
AYT003INCI000843,"Doğal Inci Kolye Bileklik Küpe Seti (PASLANMAZ ÇELİK GEMİCİ KİLİDİ, ÇELİK KÜPE APARATI)",1396.0,100.0,22.5
AYT003INCI000743,"Doğal Siyah İnci Kolye Bileklik Küpe Seti (10 mm İnci, Gül Formlu Küpe, Gemici Kilidi)",1996.0,100.0,22.5
AYT003INCI000640,Doğal Siyah Barok İnci Kolye Bileklik Küpe Set,3500.0,100.0,22.5
AYT003DGL000340,"Doğal ametist, kristal kuvars ve hematit kolye bileklik set",480.0,100.0,22.5
AYT003DGL000240,Doğal güneş taşı ve doğal inci kolye bileklik set,600.0,100.0,22.5
AYT003DGL000140,Doğal Yeşim Ve Doğal Inci Kolye Bileklik Set,480.0,100.0,22.5
AYT001INCI0007A70,Doğal barok inci kolye (Dorika Detaylı),500.0,100.0,22.5
AYT001INCI0007G70,Doğal barok inci kolye (Dorika Detaylı),500.0,100.0,22.5
AYT001INCI0005G70,Doğal barok inci kolye (Dorika Detaylı),500.0,100.0,22.5
AYT001INCI0003G70,Doğal barok inci kolye,500.0,100.0,22.5
AYT001INCI0005A70,Doğal barok inci kolye (Dorika Detaylı),500.0,100.0,22.5
AYT001INCI0006G100,Doğal barok inci uzun kolye 1 mt,996.0,100.0,22.5
AYT001INCI0006A100,Doğal barok inci uzun kolye 1 mt,996.0,100.0,22.5
AYT003IMT01140,İnci Kolye Bileklik Küpe Set Gümüş Renk O-T Klips Kapama,159.6,100.0,22.5
AYT003IMT01040,İnci Kolye Bileklik Küpe Set Altın Renk O-T Klips kapama,159.6,100.0,22.5
AYT001INCI0004G70,Doğal barok inci kolye,500.0,100.0,22.5
AYT003INCI0004G70,Doğal Barok Inci 2'li Set,500.0,100.0,22.5
AYT003INCI0003A70,Doğal Barok Inci 2'li Set,796.0,100.0,22.5
AYT001INCI0004A70,Doğal barok inci kolye,500.0,100.0,22.5
AYT001INCI0003A70,Doğal barok inci kolye,500.0,100.0,22.5
AYT003IMT00940,Gemici dümenli inci set,119.6,100.0,22.5
AYT002INCI000817,Doğal İnci Bileklik,380.0,100.0,22.5
AYT002INCI000717,Doğal İnci Bileklik,380.0,100.0,22.5
AYT002INCI000617,Doğal İnci Bileklik,440.0,100.0,22.5
AYT006INCI00503,Doğal İnci Yüzük,139.6,100.0,22.5
AYT003IMT00842,"İnci Set, Zirkon Taş Rondela Detaylı Kolye Bileklik Küpe",155.6,100.0,22.5
AYT003IMT00639,Sade Şık İnci Kolye Bileklik Set,119.6,100.0,22.5
AYT003IMT00335,Şık Zarif Elegant Barok Inci Set Kolye Bileklik Küpe,196.0,100.0,22.5
AYT006INCI004GKALP,Doğal İnci Yüzük (Hematit Kalp),108.0,100.0,22.5
AYT006INCI004AKALP,Doğal İnci Yüzük (Hematit Kalp),108.0,100.0,22.5
AYT002MTL0005G,Alaşım Kelepçe Bileklik,85.32333333333334,100.0,22.5
AYT003IMT00245,Barok Inci Kısa Kolye ve bileklik set,119.6,100.0,22.5
AYT002MTL0002,Küp Detaylı Dörtlü Kombin Bileklik Küp Kombin Bileklik,119.6,100.0,22.5
AYT002MTL000121,Angelus Model 3mm Kalın Kararmaz Unisex Bileklik Gümüş Kaplama,85.32333333333334,100.0,22.5
AYT007YILDIZ00102,Çelik Şahmeran (HEMATİT TAŞLI YILDIZ),99.6,100.0,22.5
AYT007KURE00102,Çelik Şahmeran (Küre),99.6,100.0,22.5
AYT007KURE00101,Çelik Şahmeran (Küre),99.6,100.0,22.5
AYT007YILDIZ00302,Çelik Şahmeran (SEDEF TAŞI YILDIZ),99.6,100.0,22.5
AYT007YILDIZ00101,Çelik Şahmeran (HEMATİT TAŞI YILDIZ),99.6,100.0,22.5
AYT007KALP00201,Çelik Şahmeran (HEMATİT TAŞI KALP),99.6,100.0,22.5
AYT007KALP00101,Çelik Şahmeran (HEMATİT TAŞ KALP),99.6,100.0,22.5
AYT003IMT00145,İnci Kolye Bileklik Küpe Set,159.6,100.0,22.5
AYT006INCI003AKURE,Doğal İnci Yüzük (Hematit Küre),108.0,100.0,22.5
AYT006INCI003GKURE,Doğal İnci Yüzük (Hematit Küre),108.0,100.0,22.5
AYT006INCI002AYILDIZ,Doğal İnci Yüzük (Hematit Yıldız),108.0,100.0,22.5
AYT006INCI002GYILDIZ,Doğal İnci Yüzük (Hematit Yıldız),108.0,100.0,22.5
AYT002CHARM00118,İtalyan Charm Çelik Bileklik,85.32333333333334,100.0,22.5
AYT003INCI0002A40,Doğal Inci Kolye Bileklik Set (ALTIN RENK PASLANMAZ ÇELİK ZİNCİR),500.0,100.0,22.5
AYT003INCI0001G40,Doğal Inci Kolye Bileklik Set (GÜMÜŞ RENK PASLANMAZ ÇELİK ZİNCİR),500.0,100.0,22.5
AYT002TRMLN000316,Doğal Siyah Turmalin Bileklik (6 mm),284.0,100.0,22.5
AYT002TRMLN000322,Doğal Siyah Turmalin Bileklik (6 mm),284.0,100.0,22.5
AYT002TRMLN000318,Doğal Siyah Turmalin Bileklik (6 mm),284.0,100.0,22.5
AYT002TRMLN000320,Doğal Siyah Turmalin Bileklik (6 mm),284.0,100.0,22.5
AYT002TRMLN000216,Doğal Siyah Turmalin Bileklik,324.0,100.0,22.5
AYT002TRMLN000218,Doğal Siyah Turmalin Bileklik,324.0,100.0,22.5
AYT002TRMLN000222,Doğal Siyah Turmalin Bileklik,324.0,100.0,22.5
AYT002TRMLN000220,Doğal Siyah Turmalin Bileklik,324.0,100.0,22.5
AYT002TRMLN000120,Doğal Siyah Turmalin Bileklik (Kehribar taşlı),396.0,100.0,22.5
AYT002TRMLN000118,Doğal Siyah Turmalin Bileklik (Kehribar taşlı),396.0,100.0,22.5
AYT002TRMLN000116,Doğal Siyah Turmalin Bileklik (Kehribar taşlı),396.0,100.0,22.5
AYT002TRMLN000122,Doğal Siyah Turmalin Bileklik (Kehribar taşlı),396.0,100.0,22.5
AYT003TRKZ0001G40,Doğal Turkuaz Kolye Bileklik Set,236.0,100.0,22.5
AYT003TRKZ0001A40,Doğal Turkuaz Kolye Bileklik Set,236.0,100.0,22.5
AYT003AYT0001G40,Doğal Ay Taşı Kolye Bileklik Set,240.0,100.0,22.5
AYT003AYT0001A40,Doğal Ay Taşı Kolye Bileklik Set,240.0,100.0,22.5
AYT003YSM0001G40,Doğal Yeşim Kolye Bileklik Set,248.0,100.0,22.5
AYT003YSM0001A40,Doğal Yeşim Kolye Bileklik Set,248.0,100.0,22.5
AYT004INCI00011,Doğal İnci Küpe,119.6,100.0,22.5
AYT001KOLYE000140,Doğal Barok Inci Kolye,1599.6,100.0,22.5
AYT001SET000240,Doğal Inci Kolye Bileklik Set,480.0,100.0,22.5
AYT002AQUA00118,Aquamarın Bileklik,356.0,100.0,22.5
AYT002AQUA00116,Aquamarın Bileklik,356.0,100.0,22.5
AYT002AQUA00120,Aquamarın Bileklik,356.0,100.0,22.5
AYT002AQUA00122,Aquamarın Bileklik,356.0,100.0,22.5
AYT002INCI000522,Doğal Inci Bileklik (4 Mm Inci),340.0,100.0,22.5
AYT002INCI000516,Doğal Inci Bileklik (4 Mm Inci),340.0,100.0,22.5
AYT002INCI000518,Doğal Inci Bileklik (4 Mm Inci),340.0,100.0,22.5
AYT002INCI000520,Doğal Inci Bileklik (4 Mm Inci),340.0,100.0,22.5
AYT002INCI000220,Doğal İnci Bileklik,304.0,100.0,22.5
AYT002INCI000222,Doğal İnci Bileklik,304.0,100.0,22.5
AYT002INCI000218,Doğal İnci Bileklik,304.0,100.0,22.5
AYT002INCI000216,Doğal İnci Bileklik,304.0,100.0,22.5
AYT002AMETIST000116,Doğal Ametist Bileklik,324.0,100.0,22.5
AYT002AMETIST000120,Doğal Ametist Bileklik,324.0,100.0,22.5
AYT002AMETIST000122,Doğal Ametist Bileklik,324.0,100.0,22.5
AYT002AMETIST000118,Doğal Ametist Bileklik,324.0,100.0,22.5
